{
  "$schema": "https://json-schema.org/draft/2020-12/schema",
  "$id": "https://jack-the-gamer.github.io/DigimonWorldsReCompiled-mod-index/schema/mod.schema.json",
  "title": "Digimon Worlds Re:Compiled mod index entry (meta.json)",
  "description": "Checked by tools/build-index (the source of truth); this schema is for editors.",
  "type": "object",
  "additionalProperties": false,
  "required": ["id", "title", "author", "version", "categories", "games", "repo"],
  "anyOf": [{ "required": ["github"] }, { "required": ["downloadURL"] }],
  "properties": {
    "id": { "type": "string", "pattern": "^[A-Za-z0-9_-]{1,64}$", "description": "The mod's id, exactly as in its mod.toml." },
    "title": { "type": "string", "minLength": 1, "maxLength": 80 },
    "author": { "type": "string", "minLength": 1, "maxLength": 64 },
    "version": { "type": "string", "description": "Version of the release this entry describes (1.2.0). With github set, the newest release is filled in automatically." },
    "summary": { "type": "string", "maxLength": 200, "description": "One sentence shown on the mod's card." },
    "categories": {
      "type": "array", "minItems": 1, "maxItems": 4, "uniqueItems": true,
      "items": { "enum": ["GAMEPLAY", "CONTENT", "BALANCE", "ART", "AUDIO", "UI", "QOL", "TRANSLATION", "TOTAL_CONVERSION", "LIBRARY", "TOOL", "OTHER"] }
    },
    "tags": { "type": "array", "maxItems": 8, "items": { "type": "string", "minLength": 1, "maxLength": 24 } },
    "games": { "type": "array", "minItems": 1, "items": { "enum": ["dw1", "dw2", "dw3", "any"] } },
    "repo": { "type": "string", "pattern": "^https?://", "description": "Where the source and issue tracker live." },
    "github": { "type": "string", "pattern": "^[A-Za-z0-9_.-]+/[A-Za-z0-9_.-]+$", "description": "owner/repo whose Releases carry <id>-<version>.zip. Turns on automatic version tracking." },
    "downloadURL": { "type": "string", "pattern": "^https?://", "description": "A direct link to an installable .zip; required when there is no github." },
    "license": { "type": "string" },
    "engine": { "type": "string", "description": "Re:Compiled versions the mod works with, as a semver range (\">=0.2\")." },
    "experimental": { "type": "boolean" },
    "dependencies": { "type": "array", "items": { "type": "string", "pattern": "^[A-Za-z0-9_-]+(@.+)?$" } },
    "conflicts": { "type": "array", "items": { "type": "string", "pattern": "^[A-Za-z0-9_-]+(@.+)?$" } },
    "automatic_version_check": { "type": "boolean", "description": "Follow the newest release (default true)." },
    "fixed_release_tag": { "type": "string", "description": "List this release tag instead of the newest one." }
  }
}
