{
  "id": "example-mod",
  "title": "Example Mod",
  "author": "YourName",
  "summary": "A template entry: copy this folder into mods/, rename it, and edit every field.",
  "version": "1.0.0",
  "categories": ["QOL"],
  "tags": ["template"],
  "games": ["any"],
  "repo": "https://github.com/yourname/example-mod",
  "github": "yourname/example-mod",
  "license": "MIT",
  "engine": ">=0.2"
}
